<!ELEMENT pedido (libro | cuaderno | lapiz)+>
<!ELEMENT libro (#PCDATA)>
<!ATTLIST libro titulo CDATA #REQUIRED>

<!ELEMENT cuaderno (#PCDATA)>
<!ATTLIST cuaderno num_hojas CDATA #IMPLIED>

<!ELEMENT lapiz (numero)> 
<!ELEMENT numero (#PCDATA)>
